"ICD","Description","ICA","LGPS","RF","Lasso"
"C099","Bösartige Neubildung: Tonsille, nicht näher bezeichnet",2186,2185,2031,1716
"C100","Bösartige Neubildung: Vallecula epiglottica",2186,2185,2031,1716
"C101","Bösartige Neubildung: Vorderfläche der Epiglottis",2186,2185,2031,1716
"C102","Bösartige Neubildung: Seitenwand des Oropharynx",2186,2185,2031,1716
"C108","Bösartige Neubildung: Oropharynx, mehrere Teilbereiche überlappend",2186,2185,2031,1716
"C109","Bösartige Neubildung: Oropharynx, nicht näher bezeichnet",2186,2185,2031,1716
"C110","Bösartige Neubildung: Obere Wand des Nasopharynx",2186,2185,2031,1716
"C111","Bösartige Neubildung: Hinterwand des Nasopharynx",2186,2185,2031,1716
"C112","Bösartige Neubildung: Seitenwand des Nasopharynx",2186,2185,2031,1716
"C118","Bösartige Neubildung: Nasopharynx, mehrere Teilbereiche überlappend",2186,2185,2031,1716
"C119","Bösartige Neubildung: Nasopharynx, nicht näher bezeichnet",2186,2185,2031,1716
"C12","Bösartige Neubildung des Recessus piriformis",2186,2185,2031,1716
"C131","Bösartige Neubildung: Aryepiglottische Falte, hypopharyngeale Seite",2186,2185,2031,1716
"C132","Bösartige Neubildung: Hinterwand des Hypopharynx",2186,2185,2031,1716
"C138","Bösartige Neubildung: Hypopharynx, mehrere Teilbereiche überlappend",2186,2185,2031,1716
"C139","Bösartige Neubildung: Hypopharynx, nicht näher bezeichnet",2186,2185,2031,1716
"C140","Bösartige Neubildung: Pharynx, nicht näher bezeichnet",2186,2185,2031,1716
"C150","Bösartige Neubildung: Zervikaler Ösophagus",2186,2185,2031,1716
"C153","Bösartige Neubildung: Ösophagus, oberes Drittel",2186,2185,2031,1716
"C154","Bösartige Neubildung: Ösophagus, mittleres Drittel",2186,2185,2031,1716
"C158","Bösartige Neubildung: Ösophagus, mehrere Teilbereiche überlappend",2186,2185,2031,1716
"C161","Bösartige Neubildung: Fundus ventriculi",2186,2185,2031,1716
"C164","Bösartige Neubildung: Pylorus",2186,2185,2031,1716
"C165","Bösartige Neubildung: Kleine Kurvatur des Magens, nicht näher bezeichnet",2186,2185,2031,1716
"C171","Bösartige Neubildung: Jejunum",2186,2185,2031,1716
"C178","Bösartige Neubildung: Dünndarm, mehrere Teilbereiche überlappend",2186,2185,2031,1716
"C179","Bösartige Neubildung: Dünndarm, nicht näher bezeichnet",2186,2185,2031,1716
"C181","Bösartige Neubildung: Appendix vermiformis",2186,2185,2031,1716
"C183","Bösartige Neubildung: Flexura coli dextra [hepatica]",2186,2185,2031,1716
"C188","Bösartige Neubildung: Kolon, mehrere Teilbereiche überlappend",2186,2185,2031,1716
"C210","Bösartige Neubildung: Anus, nicht näher bezeichnet",2186,2185,2031,1716
"C211","Bösartige Neubildung: Analkanal",2186,2185,2031,1716
"C218","Bösartige Neubildung: Rektum, Anus und Analkanal, mehrere Teilbereiche überlappend",2186,2185,2031,1716
"C221","Intrahepatisches Gallengangskarzinom",2186,2185,2031,1716
"C227","Sonstige näher bezeichnete Karzinome der Leber",2186,2185,2031,1716
"C229","Bösartige Neubildung: Leber, nicht näher bezeichnet",2186,2185,2031,1716
"C23","Bösartige Neubildung der Gallenblase",2186,2185,2031,1716
"C248","Bösartige Neubildung: Gallenwege, mehrere Teilbereiche überlappend",2186,2185,2031,1716
"C249","Bösartige Neubildung: Gallenwege, nicht näher bezeichnet",2186,2185,2031,1716
"C252","Bösartige Neubildung: Pankreasschwanz",2186,2185,2031,1716
"C253","Bösartige Neubildung: Ductus pancreaticus",2186,2185,2031,1716
"C257","Bösartige Neubildung: Sonstige Teile des Pankreas",2186,2185,2031,1716
"C259","Bösartige Neubildung: Pankreas, nicht näher bezeichnet",2186,2185,2031,1716
"C260","Bösartige Neubildung: Intestinaltrakt, Teil nicht näher bezeichnet",2186,2185,2031,1716
"C261","Bösartige Neubildung: Milz",2186,2185,2031,1716
"C269","Bösartige Neubildung: Ungenau bezeichnete Lokalisationen des Verdauungssystems",2186,2185,2031,1716
"C300","Bösartige Neubildung: Nasenhöhle",2186,2185,2031,1716
"C311","Bösartige Neubildung: Sinus ethmoidalis [Siebbeinzellen]",2186,2185,2031,1716
"C318","Bösartige Neubildung: Nasennebenhöhlen, mehrere Teilbereiche überlappend",2186,2185,2031,1716
"C321","Bösartige Neubildung: Supraglottis",2186,2185,2031,1716
"C328","Bösartige Neubildung: Larynx, mehrere Teilbereiche überlappend",2186,2185,2031,1716
"C329","Bösartige Neubildung: Larynx, nicht näher bezeichnet",2186,2185,2031,1716
"C33","Bösartige Neubildung der Trachea",2186,2185,2031,1716
"C37","Bösartige Neubildung des Thymus",2186,2185,2031,1716
"C381","Bösartige Neubildung: Vorderes Mediastinum",2186,2185,2031,1716
"C383","Bösartige Neubildung: Mediastinum, Teil nicht näher bezeichnet",2186,2185,2031,1716
"C390","Bösartige Neubildung: Obere Atemwege, Teil nicht näher bezeichnet",2186,2185,2031,1716
"C402","Bösartige Neubildung des Knochens und des Gelenkknorpels: Lange Knochen der unteren Extremität",2186,2185,2031,1716
"C410","Bösartige Neubildung des Knochens und des Gelenkknorpels: Knochen des Hirn- und Gesichtsschädels",2186,2185,2031,1716
"C411","Bösartige Neubildung des Knochens und des Gelenkknorpels: Unterkieferknochen",2186,2185,2031,1716
"C412","Bösartige Neubildung des Knochens und des Gelenkknorpels: Wirbelsäule",2186,2185,2031,1716
"C413","Bösartige Neubildung des Knochens und des Gelenkknorpels: Rippen, Sternum und Klavikula",2186,2185,2031,1716
"C414","Bösartige Neubildung des Knochens und des Gelenkknorpels: Beckenknochen",2186,2185,2031,1716
"C418","Bösartige Neubildung: Knochen und Gelenkknorpel, mehrere Teilbereiche überlappend",2186,2185,2031,1716
"C419","Bösartige Neubildung: Knochen und Gelenkknorpel, nicht näher bezeichnet",2186,2185,2031,1716
"C431","Bösartiges Melanom des Augenlides, einschließlich Kanthus",2186,2185,2031,1716
"C433","Bösartiges Melanom sonstiger und nicht näher bezeichneter Teile des Gesichtes",2186,2185,2031,1716
"C436","Bösartiges Melanom der oberen Extremität, einschließlich Schulter",2186,2185,2031,1716
"C438","Bösartiges Melanom der Haut, mehrere Teilbereiche überlappend",2186,2185,2031,1716
"C439","Bösartiges Melanom der Haut, nicht näher bezeichnet",2186,2185,2031,1716
"C448","Sonstige bösartige Neubildungen: Haut, mehrere Teilbereiche überlappend",2186,2185,2031,1716
"C449","Bösartige Neubildung der Haut, nicht näher bezeichnet",2186,2185,2031,1716
"C450","Mesotheliom der Pleura",2186,2185,2031,1716
"C470","Bösartige Neubildung: Periphere Nerven des Kopfes, des Gesichtes und des Halses",2186,2185,2031,1716
"C479","Bösartige Neubildung: Periphere Nerven und autonomes Nervensystem, nicht näher bezeichnet",2186,2185,2031,1716
"C481","Bösartige Neubildung: Näher bezeichnete Teile des Peritoneums",2186,2185,2031,1716
"C482","Bösartige Neubildung: Peritoneum, nicht näher bezeichnet",2186,2185,2031,1716
"C488","Bösartige Neubildung: Retroperitoneum und Peritoneum, mehrere Teilbereiche überlappend",2186,2185,2031,1716
"C491","Bösartige Neubildung: Bindegewebe und andere Weichteilgewebe der oberen Extremität, einschließlich Schulter",2186,2185,2031,1716
"C493","Bösartige Neubildung: Bindegewebe und andere Weichteilgewebe des Thorax",2186,2185,2031,1716
"C495","Bösartige Neubildung: Bindegewebe und andere Weichteilgewebe des Beckens",2186,2185,2031,1716
"C496","Bösartige Neubildung: Bindegewebe und andere Weichteilgewebe des Rumpfes, nicht näher bezeichnet",2186,2185,2031,1716
"C498","Bösartige Neubildung: Bindegewebe und andere Weichteilgewebe, mehrere Teilbereiche überlappend",2186,2185,2031,1716
"C500","Bösartige Neubildung: Brustwarze und Warzenhof",2186,2185,2031,1716
"C506","Bösartige Neubildung: Recessus axillaris der Brustdrüse",2186,2185,2031,1716
"C510","Bösartige Neubildung der Vulva: Labium majus",2186,2185,2031,1716
"C511","Bösartige Neubildung der Vulva: Labium minus",2186,2185,2031,1716
"C512","Bösartige Neubildung der Vulva: Klitoris",2186,2185,2031,1716
"C52","Bösartige Neubildung der Vagina",2186,2185,2031,1716
"C530","Bösartige Neubildung: Endozervix",2186,2185,2031,1716
"C531","Bösartige Neubildung: Ektozervix",2186,2185,2031,1716
"C539","Bösartige Neubildung: Cervix uteri, nicht näher bezeichnet",2186,2185,2031,1716
"C540","Bösartige Neubildung: Isthmus uteri",2186,2185,2031,1716
"C542","Bösartige Neubildung: Myometrium",2186,2185,2031,1716
"C543","Bösartige Neubildung: Fundus uteri",2186,2185,2031,1716
"C548","Bösartige Neubildung: Corpus uteri, mehrere Teilbereiche überlappend",2186,2185,2031,1716
"C549","Bösartige Neubildung: Corpus uteri, nicht näher bezeichnet",2186,2185,2031,1716
"C55","Bösartige Neubildung des Uterus, Teil nicht näher bezeichnet",2186,2185,2031,1716
"C56","Bösartige Neubildung des Ovars",2186,2185,2031,1716
"C570","Bösartige Neubildung: Tuba uterina [Falloppio]",2186,2185,2031,1716
"C574","Bösartige Neubildung: Uterine Adnexe, nicht näher bezeichnet",2186,2185,2031,1716
"C577","Bösartige Neubildung: Sonstige näher bezeichnete weibliche Genitalorgane",2186,2185,2031,1716
"C578","Bösartige Neubildung: Weibliche Genitalorgane, mehrere Teilbereiche überlappend",2186,2185,2031,1716
"C579","Bösartige Neubildung: Weibliches Genitalorgan, nicht näher bezeichnet",2186,2185,2031,1716
"C58","Bösartige Neubildung der Plazenta",2186,2185,2031,1716
"C601","Bösartige Neubildung: Glans penis",2186,2185,2031,1716
"C608","Bösartige Neubildung: Penis, mehrere Teilbereiche überlappend",2186,2185,2031,1716
"C609","Bösartige Neubildung: Penis, nicht näher bezeichnet",2186,2185,2031,1716
"C620","Bösartige Neubildung: Dystoper Hoden",2186,2185,2031,1716
"C638","Bösartige Neubildung: Männliche Genitalorgane, mehrere Teilbereiche überlappend",2186,2185,2031,1716
"C639","Bösartige Neubildung: Männliches Genitalorgan, nicht näher bezeichnet",2186,2185,2031,1716
"C66","Bösartige Neubildung des Ureters",2186,2185,2031,1716
"C673","Bösartige Neubildung: Vordere Harnblasenwand",2186,2185,2031,1716
"C675","Bösartige Neubildung: Harnblasenhals",2186,2185,2031,1716
"C680","Bösartige Neubildung: Urethra",2186,2185,2031,1716
"C688","Bösartige Neubildung: Harnorgane, mehrere Teilbereiche überlappend",2186,2185,2031,1716
"C690","Bösartige Neubildung: Konjunktiva",2186,2185,2031,1716
"C693","Bösartige Neubildung: Chorioidea",2186,2185,2031,1716
"C696","Bösartige Neubildung: Orbita",2186,2185,2031,1716
"C701","Bösartige Neubildung: Rückenmarkhäute",2186,2185,2031,1716
"C713","Bösartige Neubildung: Parietallappen",2186,2185,2031,1716
"C714","Bösartige Neubildung: Okzipitallappen",2186,2185,2031,1716
"C715","Bösartige Neubildung: Hirnventrikel",2186,2185,2031,1716
"C716","Bösartige Neubildung: Zerebellum",2186,2185,2031,1716
"C717","Bösartige Neubildung: Hirnstamm",2186,2185,2031,1716
"C720","Bösartige Neubildung: Rückenmark",2186,2185,2031,1716
"C722","Bösartige Neubildung: Nn. olfactorii [I. Hirnnerv]",2186,2185,2031,1716
"C73","Bösartige Neubildung der Schilddrüse",2186,2185,2031,1716
"C740","Bösartige Neubildung: Nebennierenrinde",2186,2185,2031,1716
"C741","Bösartige Neubildung: Nebennierenmark",2186,2185,2031,1716
"C759","Bösartige Neubildung: Endokrine Drüse, nicht näher bezeichnet",2186,2185,2031,1716
"C760","Bösartige Neubildung ungenau bezeichneter Lokalisationen: Kopf, Gesicht und Hals",2186,2185,2031,1716
"C761","Bösartige Neubildung ungenau bezeichneter Lokalisationen: Thorax",2186,2185,2031,1716
"C762","Bösartige Neubildung ungenau bezeichneter Lokalisationen: Abdomen",2186,2185,2031,1716
"C763","Bösartige Neubildung ungenau bezeichneter Lokalisationen: Becken",2186,2185,2031,1716
"C768","Bösartige Neubildung: Sonstige und ungenau bezeichnete Lokalisationen, mehrere Teilbereiche überlappend",2186,2185,2031,1716
"C770","Sekundäre und nicht näher bezeichnete bösartige Neubildung: Lymphknoten des Kopfes, des Gesichtes und des Halses",2186,2185,2031,1716
"C771","Sekundäre und nicht näher bezeichnete bösartige Neubildung: Intrathorakale Lymphknoten",2186,2185,2031,1716
"C774","Sekundäre und nicht näher bezeichnete bösartige Neubildung: Inguinale Lymphknoten und Lymphknoten der unteren Extremität",2186,2185,2031,1716
"C775","Sekundäre und nicht näher bezeichnete bösartige Neubildung: Intrapelvine Lymphknoten",2186,2185,2031,1716
"C779","Sekundäre und nicht näher bezeichnete bösartige Neubildung: Lymphknoten, nicht näher bezeichnet",2186,2185,2031,1716
"C784","Sekundäre bösartige Neubildung des Dünndarmes",2186,2185,2031,1716
"C785","Sekundäre bösartige Neubildung des Dickdarmes und des Rektums",2186,2185,2031,1716
"C797","Sekundäre bösartige Neubildung der Nebenniere",2186,2185,2031,1716
"C800","Bösartige Neubildung, primäre Lokalisation unbekannt, so bezeichnet",2186,2185,2031,1716
"C809","Bösartige Neubildung, nicht näher bezeichnet",2186,2185,2031,1716
"C811","Nodulär-sklerosierendes (klassisches) Hodgkin-Lymphom",2186,2185,2031,1716
"C812","Gemischtzelliges (klassisches) Hodgkin-Lymphom",2186,2185,2031,1716
"C813","Lymphozytenarmes (klassisches) Hodgkin-Lymphom",2186,2185,2031,1716
"C814","Lymphozytenreiches (klassisches) Hodgkin-Lymphom",2186,2185,2031,1716
"C817","Sonstige Typen des (klassischen) Hodgkin-Lymphoms",2186,2185,2031,1716
"C819","Hodgkin-Lymphom, nicht näher bezeichnet",2186,2185,2031,1716
"C820","Follikuläres Lymphom Grad I",2186,2185,2031,1716
"C822","Follikuläres Lymphom Grad III, nicht näher bezeichnet",2186,2185,2031,1716
"C823","Follikuläres Lymphom Grad IIIa",2186,2185,2031,1716
"C824","Follikuläres Lymphom Grad IIIb",2186,2185,2031,1716
"C826","Kutanes Follikelzentrumslymphom",2186,2185,2031,1716
"C829","Follikuläres Lymphom, nicht näher bezeichnet",2186,2185,2031,1716
"C831","Mantelzell-Lymphom",2186,2185,2031,1716
"C835","Lymphoblastisches Lymphom",2186,2185,2031,1716
"C837","Burkitt-Lymphom",2186,2185,2031,1716
"C838","Sonstige nicht follikuläre Lymphome",2186,2185,2031,1716
"C840","Mycosis fungoides",2186,2185,2031,1716
"C841","Sézary-Syndrom",2186,2185,2031,1716
"C846","Anaplastisches großzelliges Lymphom, ALK-positiv",2186,2185,2031,1716
"C848","Kutanes T-Zell-Lymphom, nicht näher bezeichnet",2186,2185,2031,1716
"C849","Reifzelliges T/NK-Zell-Lymphom, nicht näher bezeichnet",2186,2185,2031,1716
"C852","Mediastinales (thymisches) großzelliges B-Zell-Lymphom",2186,2185,2031,1716
"C857","Sonstige näher bezeichnete Typen des Non-Hodgkin-Lymphoms",2186,2185,2031,1716
"C862","T-Zell-Lymphom vom Enteropathie-Typ",2186,2185,2031,1716
"C866","Primäre kutane CD30-positive T-Zell-Proliferationen",2186,2185,2031,1716
"C880","Makroglobulinämie Waldenström",2186,2185,2031,1716
"C882","Sonstige Schwerkettenkrankheit",2186,2185,2031,1716
"C884","Extranodales Marginalzonen-B-Zell-Lymphom des Mukosa-assoziierten lymphatischen Gewebes [MALT-Lymphom]",2186,2185,2031,1716
"C901","Plasmazellenleukämie",2186,2185,2031,1716
"C902","Extramedulläres Plasmozytom",2186,2185,2031,1716
"C914","Haarzellenleukämie",2186,2185,2031,1716
"C915","Adulte(s) T-Zell-Lymphom/Leukämie (HTLV-1-assoziiert)",2186,2185,2031,1716
"C919","Lymphatische Leukämie, nicht näher bezeichnet",2186,2185,2031,1716
"C920","Akute myeloblastische Leukämie [AML]",2186,2185,2031,1716
"C921","Chronische myeloische Leukämie [CML], BCR/ABL-positiv",2186,2185,2031,1716
"C923","Myelosarkom",2186,2185,2031,1716
"C928","Akute myeloische Leukämie mit multilineärer Dysplasie",2186,2185,2031,1716
"C931","Chronische myelomonozytäre Leukämie",2186,2185,2031,1716
"C942","Akute Megakaryoblastenleukämie",2186,2185,2031,1716
"C944","Akute Panmyelose mit Myelofibrose",2186,2185,2031,1716
"C950","Akute Leukämie nicht näher bezeichneten Zelltyps",2186,2185,2031,1716
"C960","Multifokale und multisystemische (disseminierte) Langerhans-Zell-Histiozytose [Abt-Letterer-Siwe-Krankheit]",2186,2185,2031,1716
"C965","Multifokale und unisystemische Langerhans-Zell-Histiozytose",2186,2185,2031,1716
"C966","Unifokale Langerhans-Zell-Histiozytose",2186,2185,2031,1716
"C969","Bösartige Neubildung des lymphatischen, blutbildenden und verwandten Gewebes, nicht näher bezeichnet",2186,2185,2031,1716
"D002","Carcinoma in situ: Magen",2186,2185,2031,1716
"D012","Carcinoma in situ: Rektum",2186,2185,2031,1716
"D014","Carcinoma in situ: Sonstige und nicht näher bezeichnete Teile des Darmes",2186,2185,2031,1716
"D020","Carcinoma in situ: Larynx",2186,2185,2031,1716
"D022","Carcinoma in situ: Bronchus und Lunge",2186,2185,2031,1716
"D023","Carcinoma in situ: Sonstige Teile des Atmungssystems",2186,2185,2031,1716
"D031","Melanoma in situ des Augenlides, einschließlich Kanthus",2186,2185,2031,1716
"D032","Melanoma in situ des Ohres und des äußeren Gehörganges",2186,2185,2031,1716
"D033","Melanoma in situ sonstiger und nicht näher bezeichneter Teile des Gesichtes",2186,2185,2031,1716
"D036","Melanoma in situ der oberen Extremität, einschließlich Schulter",2186,2185,2031,1716
"D037","Melanoma in situ der unteren Extremität, einschließlich Hüfte",2186,2185,2031,1716
"D038","Melanoma in situ an sonstigen Lokalisationen",2186,2185,2031,1716
"D042","Carcinoma in situ: Haut des Ohres und des äußeren Gehörganges",2186,2185,2031,1716
"D044","Carcinoma in situ: Behaarte Kopfhaut und Haut des Halses",2186,2185,2031,1716
"D045","Carcinoma in situ: Haut des Rumpfes",2186,2185,2031,1716
"D046","Carcinoma in situ: Haut der oberen Extremität, einschließlich Schulter",2186,2185,2031,1716
"D050","Lobuläres Carcinoma in situ der Brustdrüse",2186,2185,2031,1716
"D057","Sonstiges Carcinoma in situ der Brustdrüse",2186,2185,2031,1716
"D060","Carcinoma in situ: Endozervix",2186,2185,2031,1716
"D061","Carcinoma in situ: Ektozervix",2186,2185,2031,1716
"D067","Carcinoma in situ: Sonstige Teile der Cervix uteri",2186,2185,2031,1716
"D071","Carcinoma in situ: Vulva",2186,2185,2031,1716
"D074","Carcinoma in situ: Penis",2186,2185,2031,1716
"D075","Carcinoma in situ: Prostata",2186,2185,2031,1716
"D076","Carcinoma in situ: Sonstige und nicht näher bezeichnete männliche Genitalorgane",2186,2185,2031,1716
"D090","Carcinoma in situ: Harnblase",2186,2185,2031,1716
"D103","Gutartige Neubildung: Sonstige und nicht näher bezeichnete Teile des Mundes",2186,2185,2031,1716
"D104","Gutartige Neubildung: Tonsille",2186,2185,2031,1716
"D105","Gutartige Neubildung: Sonstige Teile des Oropharynx",2186,2185,2031,1716
"D106","Gutartige Neubildung: Nasopharynx",2186,2185,2031,1716
"D109","Gutartige Neubildung: Pharynx, nicht näher bezeichnet",2186,2185,2031,1716
"D117","Gutartige Neubildung: Sonstige große Speicheldrüsen",2186,2185,2031,1716
"D121","Gutartige Neubildung: Appendix vermiformis",2186,2185,2031,1716
"D123","Gutartige Neubildung: Colon transversum",2186,2185,2031,1716
"D124","Gutartige Neubildung: Colon descendens",2186,2185,2031,1716
"D128","Gutartige Neubildung: Rektum",2186,2185,2031,1716
"D129","Gutartige Neubildung: Analkanal und Anus",2186,2185,2031,1716
"D130","Gutartige Neubildung: Ösophagus",2186,2185,2031,1716
"D131","Gutartige Neubildung: Magen",2186,2185,2031,1716
"D132","Gutartige Neubildung: Duodenum",2186,2185,2031,1716
"D134","Gutartige Neubildung: Leber",2186,2185,2031,1716
"D136","Gutartige Neubildung: Pankreas",2186,2185,2031,1716
"D141","Gutartige Neubildung: Larynx",2186,2185,2031,1716
"D150","Gutartige Neubildung: Thymus",2186,2185,2031,1716
"D152","Gutartige Neubildung: Mediastinum",2186,2185,2031,1716
"D160","Gutartige Neubildung des Knochens und des Gelenkknorpels: Skapula und lange Knochen der oberen Extremität",2186,2185,2031,1716
"D162","Gutartige Neubildung des Knochens und des Gelenkknorpels: Lange Knochen der unteren Extremität",2186,2185,2031,1716
"D163","Gutartige Neubildung des Knochens und des Gelenkknorpels: Kurze Knochen der unteren Extremität",2186,2185,2031,1716
"D165","Gutartige Neubildung des Knochens und des Gelenkknorpels: Unterkieferknochen",2186,2185,2031,1716
"D167","Gutartige Neubildung des Knochens und des Gelenkknorpels: Rippen, Sternum und Klavikula",2186,2185,2031,1716
"D169","Gutartige Neubildung: Knochen und Gelenkknorpel, nicht näher bezeichnet",2186,2185,2031,1716
"D170","Gutartige Neubildung des Fettgewebes der Haut und der Unterhaut des Kopfes, des Gesichtes und des Halses",2186,2185,2031,1716
"D174","Gutartige Neubildung des Fettgewebes der intrathorakalen Organe",2186,2185,2031,1716
"D175","Gutartige Neubildung des Fettgewebes der intraabdominalen Organe",2186,2185,2031,1716
"D176","Gutartige Neubildung des Fettgewebes des Samenstrangs",2186,2185,2031,1716
"D177","Gutartige Neubildung des Fettgewebes an sonstigen Lokalisationen",2186,2185,2031,1716
"D180","Hämangiom",2186,2185,2031,1716
"D200","Gutartige Neubildung: Retroperitoneum",2186,2185,2031,1716
"D211","Sonstige gutartige Neubildungen: Bindegewebe und andere Weichteilgewebe der oberen Extremität, einschließlich Schulter",2186,2185,2031,1716
"D212","Sonstige gutartige Neubildungen: Bindegewebe und andere Weichteilgewebe der unteren Extremität, einschließlich Hüfte",2186,2185,2031,1716
"D213","Sonstige gutartige Neubildungen: Bindegewebe und andere Weichteilgewebe des Thorax",2186,2185,2031,1716
"D214","Sonstige gutartige Neubildungen: Bindegewebe und andere Weichteilgewebe des Abdomens",2186,2185,2031,1716
"D215","Sonstige gutartige Neubildungen: Bindegewebe und andere Weichteilgewebe des Beckens",2186,2185,2031,1716
"D219","Sonstige gutartige Neubildungen: Bindegewebe und andere Weichteilgewebe, nicht näher bezeichnet",2186,2185,2031,1716
"D225","Melanozytennävus des Rumpfes",2186,2185,2031,1716
"D227","Melanozytennävus der unteren Extremität, einschließlich Hüfte",2186,2185,2031,1716
"D231","Sonstige gutartige Neubildungen: Haut des Augenlides, einschließlich Kanthus",2186,2185,2031,1716
"D232","Sonstige gutartige Neubildungen: Haut des Ohres und des äußeren Gehörganges",2186,2185,2031,1716
"D233","Sonstige gutartige Neubildungen: Haut sonstiger und nicht näher bezeichneter Teile des Gesichtes",2186,2185,2031,1716
"D235","Sonstige gutartige Neubildungen: Haut des Rumpfes",2186,2185,2031,1716
"D236","Sonstige gutartige Neubildungen: Haut der oberen Extremität, einschließlich Schulter",2186,2185,2031,1716
"D239","Sonstige gutartige Neubildungen: Haut, nicht näher bezeichnet",2186,2185,2031,1716
"D250","Submuköses Leiomyom des Uterus",2186,2185,2031,1716
"D260","Sonstige gutartige Neubildungen: Cervix uteri",2186,2185,2031,1716
"D261","Sonstige gutartige Neubildungen: Corpus uteri",2186,2185,2031,1716
"D280","Gutartige Neubildung: Vulva",2186,2185,2031,1716
"D281","Gutartige Neubildung: Vagina",2186,2185,2031,1716
"D290","Gutartige Neubildung: Penis",2186,2185,2031,1716
"D291","Gutartige Neubildung: Prostata",2186,2185,2031,1716
"D292","Gutartige Neubildung: Hoden",2186,2185,2031,1716
"D302","Gutartige Neubildung: Ureter",2186,2185,2031,1716
"D310","Gutartige Neubildung: Konjunktiva",2186,2185,2031,1716
"D329","Gutartige Neubildung: Meningen, nicht näher bezeichnet",2186,2185,2031,1716
"D330","Gutartige Neubildung: Gehirn, supratentoriell",2186,2185,2031,1716
"D331","Gutartige Neubildung: Gehirn, infratentoriell",2186,2185,2031,1716
"D34","Gutartige Neubildung der Schilddrüse",2186,2185,2031,1716
"D351","Gutartige Neubildung: Nebenschilddrüse",2186,2185,2031,1716
"D353","Gutartige Neubildung: Ductus craniopharyngealis",2186,2185,2031,1716
"D360","Gutartige Neubildung: Lymphknoten",2186,2185,2031,1716
"D361","Gutartige Neubildung: Periphere Nerven und autonomes Nervensystem",2186,2185,2031,1716
"D367","Gutartige Neubildung: Sonstige näher bezeichnete Lokalisationen",2186,2185,2031,1716
"D369","Gutartige Neubildung an nicht näher bezeichneter Lokalisation",2186,2185,2031,1716
"D372","Neubildung unsicheren oder unbekannten Verhaltens: Dünndarm",2186,2185,2031,1716
"D373","Neubildung unsicheren oder unbekannten Verhaltens: Appendix vermiformis",2186,2185,2031,1716
"D374","Neubildung unsicheren oder unbekannten Verhaltens: Kolon",2186,2185,2031,1716
"D375","Neubildung unsicheren oder unbekannten Verhaltens: Rektum",2186,2185,2031,1716
"D382","Neubildung unsicheren oder unbekannten Verhaltens: Pleura",2186,2185,2031,1716
"D383","Neubildung unsicheren oder unbekannten Verhaltens: Mediastinum",2186,2185,2031,1716
"D384","Neubildung unsicheren oder unbekannten Verhaltens: Thymus",2186,2185,2031,1716
"D385","Neubildung unsicheren oder unbekannten Verhaltens: Sonstige Atmungsorgane",2186,2185,2031,1716
"D386","Neubildung unsicheren oder unbekannten Verhaltens: Atmungsorgan, nicht näher bezeichnet",2186,2185,2031,1716
"D390","Neubildung unsicheren oder unbekannten Verhaltens: Uterus",2186,2185,2031,1716
"D397","Neubildung unsicheren oder unbekannten Verhaltens: Sonstige weibliche Genitalorgane",2186,2185,2031,1716
"D399","Neubildung unsicheren oder unbekannten Verhaltens: Weibliches Genitalorgan, nicht näher bezeichnet",2186,2185,2031,1716
"D401","Neubildung unsicheren oder unbekannten Verhaltens: Hoden",2186,2185,2031,1716
"D407","Neubildung unsicheren oder unbekannten Verhaltens: Sonstige männliche Genitalorgane",2186,2185,2031,1716
"D411","Neubildung unsicheren oder unbekannten Verhaltens: Nierenbecken",2186,2185,2031,1716
"D412","Neubildung unsicheren oder unbekannten Verhaltens: Ureter",2186,2185,2031,1716
"D419","Neubildung unsicheren oder unbekannten Verhaltens: Harnorgan, nicht näher bezeichnet",2186,2185,2031,1716
"D420","Neubildung unsicheren oder unbekannten Verhaltens: Hirnhäute",2186,2185,2031,1716
"D430","Neubildung unsicheren oder unbekannten Verhaltens: Gehirn, supratentoriell",2186,2185,2031,1716
"D431","Neubildung unsicheren oder unbekannten Verhaltens: Gehirn, infratentoriell",2186,2185,2031,1716
"D439","Neubildung unsicheren oder unbekannten Verhaltens: Zentralnervensystem, nicht näher bezeichnet",2186,2185,2031,1716
"D443","Neubildung unsicheren oder unbekannten Verhaltens: Hypophyse",2186,2185,2031,1716
"D444","Neubildung unsicheren oder unbekannten Verhaltens: Ductus craniopharyngealis",2186,2185,2031,1716
